{
  "schema_version": 2,
  "packet_type": "model_decision_context",
  "data_version": "2026-07-27-reviewed",
  "objective": {
    "goal_id": "gold_origin",
    "goal_display_name": "赚钱+搓玉",
    "layout": "342",
    "online_count": 3,
    "online_times": [
      "08:00",
      "14:00",
      "20:00"
    ],
    "products": [
      "base_management",
      "battle_record",
      "drone_recovery",
      "hr_network",
      "lmd_order",
      "orundum_order",
      "orundum_shard",
      "pure_gold"
    ],
    "preferences": {
      "priority": "guide_fidelity"
    }
  },
  "baseline": {
    "reference_id": "guide_342_orundum_3_login",
    "template": {
      "display_name": "342 赚钱与搓玉三次上线攻略基线",
      "goal": "gold_origin",
      "layout": "342",
      "status": "community_guide_baseline",
      "source": {
        "source_type": "user_provided_guide_image",
        "title": "搓玉342-3队列",
        "retrieved_at": "2026-07-27",
        "verification": "structure_extracted_from_user_image",
        "notes": "仓库仅保存结构化摘要，不再分发原图。具体干员组合需要按当前版本攻略与用户 roster 再核验。"
      },
      "facility_configuration": {
        "rooms": {
          "trading_post_1": {
            "facility_id": "trading_post",
            "level": 3,
            "product_id": "lmd_order"
          },
          "trading_post_2": {
            "facility_id": "trading_post",
            "level": 3,
            "product_id": "lmd_order"
          },
          "trading_post_3": {
            "facility_id": "trading_post",
            "level": 1,
            "product_id": "orundum_order"
          },
          "factory_1": {
            "facility_id": "factory",
            "level": 3,
            "product_id": "pure_gold"
          },
          "factory_2": {
            "facility_id": "factory",
            "level": 3,
            "product_id": "pure_gold"
          },
          "factory_3": {
            "facility_id": "factory",
            "level": 2,
            "product_id": "orundum_shard"
          },
          "factory_4": {
            "facility_id": "factory",
            "level": 2,
            "product_id": "battle_record"
          },
          "power_plant_1": {
            "facility_id": "power_plant",
            "level": 3,
            "product_id": "drone_recovery"
          },
          "power_plant_2": {
            "facility_id": "power_plant",
            "level": 3,
            "product_id": "drone_recovery"
          },
          "control_center": {
            "facility_id": "control_center",
            "level": 5,
            "product_id": "base_management"
          },
          "office": {
            "facility_id": "office",
            "level": 3,
            "product_id": "hr_network"
          }
        },
        "dormitories": [
          {
            "room_id": "dormitory_1",
            "level": 1
          },
          {
            "room_id": "dormitory_2",
            "level": 1
          },
          {
            "room_id": "dormitory_3",
            "level": 1
          },
          {
            "room_id": "dormitory_4",
            "level": 1
          }
        ]
      },
      "operation_model": {
        "online_count": 3,
        "default_online_times": [
          "08:00",
          "14:00",
          "20:00"
        ],
        "segment_hours": [
          6,
          6,
          12
        ],
        "room_rotation_guidance": {
          "queue_1": [
            12
          ],
          "queue_2": [
            12,
            6
          ],
          "queue_3": [
            12,
            6
          ]
        },
        "principle": "上线次数定义可操作节点，房间人员可以跨相邻区间连续工作，不能机械拆成三个等长班次。"
      },
      "recovery_requirements": {
        "fiammetta_priority_targets": [
          "但书",
          "清流"
        ],
        "requires_recovery_plan": true,
        "requires_repeating_day_check": true,
        "notes": "核心组合允许重复使用，前提是宿舍、菲亚梅塔和下一周期心情时间线可验证。"
      },
      "economy_baseline": {
        "approximate": true,
        "daily": {
          "lmd_orders_lmd": 47000,
          "pure_gold_lmd_equivalent": 44000,
          "pure_gold_drone_lmd_equivalent": 9400,
          "orundum": 535,
          "battle_record_exp": 14000
        },
        "costs": {
          "orirock_cube": 100,
          "lmd": 80000,
          "orundum_shard_inventory_delta": -4
        },
        "drone_alternatives": {
          "lmd_orders": 14000,
          "pure_gold": 6700,
          "battle_record_exp": 5300
        },
        "notes": "数值来自用户提供攻略图的预估栏，只作为基准比较，不替代当前版本实测。"
      },
      "required_final_checks": [
        "current_guide_verified",
        "facility_levels_match",
        "all_production_operator_skills_verified",
        "room_specific_rotation_verified",
        "morale_and_recovery_timeline_verified",
        "warehouse_overflow_checked",
        "economy_projection_complete",
        "baseline_deviations_explained"
      ]
    },
    "rule": "先以当前攻略基线构造候选，再根据 roster、设施和上线时间做局部替换。"
  },
  "facility_configuration": {
    "rooms": {
      "trading_post_1": {
        "facility_id": "trading_post",
        "level": 3,
        "product_id": "lmd_order"
      },
      "trading_post_2": {
        "facility_id": "trading_post",
        "level": 3,
        "product_id": "lmd_order"
      },
      "trading_post_3": {
        "facility_id": "trading_post",
        "level": 1,
        "product_id": "orundum_order"
      },
      "factory_1": {
        "facility_id": "factory",
        "level": 3,
        "product_id": "pure_gold"
      },
      "factory_2": {
        "facility_id": "factory",
        "level": 3,
        "product_id": "pure_gold"
      },
      "factory_3": {
        "facility_id": "factory",
        "level": 2,
        "product_id": "orundum_shard"
      },
      "factory_4": {
        "facility_id": "factory",
        "level": 2,
        "product_id": "battle_record"
      },
      "power_plant_1": {
        "facility_id": "power_plant",
        "level": 3,
        "product_id": "drone_recovery"
      },
      "power_plant_2": {
        "facility_id": "power_plant",
        "level": 3,
        "product_id": "drone_recovery"
      },
      "control_center": {
        "facility_id": "control_center",
        "level": 5,
        "product_id": "base_management"
      },
      "office": {
        "facility_id": "office",
        "level": 3,
        "product_id": "hr_network"
      }
    },
    "dormitories": [
      {
        "room_id": "dormitory_1",
        "level": 1
      },
      {
        "room_id": "dormitory_2",
        "level": 1
      },
      {
        "room_id": "dormitory_3",
        "level": 1
      },
      {
        "room_id": "dormitory_4",
        "level": 1
      }
    ]
  },
  "operation_nodes": [
    {
      "time": "08:00",
      "label": "第1次上线",
      "actions": [
        "收取产物",
        "执行计划中的换班与恢复"
      ]
    },
    {
      "time": "14:00",
      "label": "第2次上线",
      "actions": [
        "收取产物",
        "执行计划中的换班与恢复"
      ]
    },
    {
      "time": "20:00",
      "label": "第3次上线",
      "actions": [
        "收取产物",
        "执行计划中的换班与恢复"
      ]
    }
  ],
  "segment_template": {
    "segment_1": {
      "name": "区间1",
      "start": "08:00",
      "end": "14:00",
      "hours": 6.0,
      "rooms": {}
    },
    "segment_2": {
      "name": "区间2",
      "start": "14:00",
      "end": "20:00",
      "hours": 6.0,
      "rooms": {}
    },
    "segment_3": {
      "name": "区间3",
      "start": "20:00",
      "end": "08:00",
      "hours": 12.0,
      "rooms": {}
    }
  },
  "hard_rules": {
    "same_segment_duplicate_forbidden": true,
    "operator_must_exist_in_roster": true,
    "elite_level_from_roster": true,
    "product_must_match_facility": true,
    "facility_level_controls_capacity": true,
    "final_plan_requires_verified_skill_data": true,
    "final_plan_requires_room_specific_timeline": true,
    "final_plan_requires_repeating_day_morale_check": true,
    "final_gold_origin_requires_economy_projection": true,
    "unknown_local_operator_skill_requires_verified_external_evidence": true
  },
  "model_decision_requirements": {
    "candidate_count": {
      "minimum": 2,
      "recommended": 3
    },
    "candidate_schema": "schemas/candidate-plan.schema.json",
    "must_start_from_current_guide_baseline": true,
    "must_explain_every_baseline_deviation": true,
    "must_state_strategy": true,
    "must_state_tradeoffs": true,
    "must_validate_each_candidate": true,
    "must_evaluate_each_valid_candidate": true,
    "must_compare_to_baseline": true,
    "script_ranking_is_advisory": true
  },
  "roster": [
    {
      "name": "但书",
      "elite": 2,
      "recruited": true,
      "morale": 24.0
    },
    {
      "name": "龙舌兰",
      "elite": 2,
      "recruited": true,
      "morale": 24.0
    },
    {
      "name": "巫恋",
      "elite": 2,
      "recruited": true,
      "morale": 24.0
    },
    {
      "name": "鸿雪",
      "elite": 2,
      "recruited": true,
      "morale": 24.0
    },
    {
      "name": "图耶",
      "elite": 2,
      "recruited": true,
      "morale": 24.0
    },
    {
      "name": "绮良",
      "elite": 2,
      "recruited": true,
      "morale": 24.0
    },
    {
      "name": "可露希尔",
      "elite": 2,
      "recruited": true,
      "morale": 24.0
    },
    {
      "name": "月见夜",
      "elite": 2,
      "recruited": true,
      "morale": 24.0
    },
    {
      "name": "空爆",
      "elite": 2,
      "recruited": true,
      "morale": 24.0
    },
    {
      "name": "玫兰莎",
      "elite": 2,
      "recruited": true,
      "morale": 24.0
    },
    {
      "name": "慕斯",
      "elite": 2,
      "recruited": true,
      "morale": 24.0
    },
    {
      "name": "雪雉",
      "elite": 2,
      "recruited": true,
      "morale": 24.0
    },
    {
      "name": "拜松",
      "elite": 2,
      "recruited": true,
      "morale": 24.0
    },
    {
      "name": "推进之王",
      "elite": 2,
      "recruited": true,
      "morale": 24.0
    },
    {
      "name": "摩根",